9855,"esse tweet que compara os presidenciáveis com base em suas formações me deixou profundamente irritada. o problema do bolsonaro não é ele não ser advogado como o haddad ou médico como o alckmin, é ele não ter preparo pra lidar com diferença humana e só pregar ódio e horror"
9906,"porra!!!!!!!!! existiu um projeto ESCOLA SEM HOMOFOBIA (que não é o livro que bolsonaro divulgou), que o bolsonaro apelidou de kit gay, mas ele não foi aprovado, logo NÃO CHEGOU A SER PRODUZIDO ou DISTRIBUÍDO. coloquei em caps agora pra te ajudar na leitura. paz"
9913,"primeiro que o escola sem homofobia não era destinado a crianças de 6 anos, como o bolsonaro gosta de falar. segundo que NEM TODO MUNDO TEM PAIS. a escola tem sim obrigação de educar e ensinar o respeito, porque nem todo mundo tem esse privilégio em casa. sai da bolha"
9914,você já leu o escola sem homofobia? não é nem parecido com o material que bolsonaro mostrou
9918,quero ver haddad e bolsonaro no mão a mao 
9922,"mano na real eu vou votar no haddad pra barrar o bolsonaro, mas pelo que eu li das propostas eu tô realmente cética quanto ao governo dele não penso que ele vá reestruturar a economia, e talvez pode até piorar"
9934,"a esquerda fez a fama do bolsonaro, e agora a esquerda vai eleger o bolsonaro votando no haddad namoral vcs sao muito burro"
9946,"a pesquisa mais recente quem lidera é o bolsonaro, com ciro em segundo. o pt e lula estão enrolando pra apresentar o haddad."
9947,lendo o plano de governo do ciro gomes e considerando votar nele real bolsonaro ta liderando a pesquisa e haddad nao vai ganhar.
9950,"@ jornalnacional picareta demais! Foram na casa do Haddad, foram na PUC. Isto é cobertura exclusiva!! @ leandroruschel @ jairbolsonaro @ lobaoeletrico. Absurdo!"
9951,"@ jornalnacional fazendo propaganda política descarada para Haddad. Chamam @ jairbolsonaro de “adversário”. Tom de documentário da vida de um “estadista”. Absurdo @ TSEjusbr !! Absurdo, # GloboLixo"
9952,"Exato. Haddad é o candidato das elites, dos guarda-costas, das viagens à Paris, do caviar e champanhe, dos show do Chico e Caetano, dos meninos e meninas ricos do Leblon fingindo pobreza e fumando maconha. O povo está com @ jairbolsonaro"
9996,"É de graça, viu @ gleisi e @ Haddad_Fernando ? Mostro a fatura do Wi-Fi na minha conta  # BolsonaroSim"
9998,Anule a eleição. A gente vota no @ jairbolsonaro de novo e ele leva no primeiro turno
10004,"Vamos falar a verdade: não é debate coisa nenhuma. É artilharia, é guerra. Ninguém ouve ninguém, só ataca. Para que ir? @ Haddad_Fernando @ jairbolsonaro # EleSim # LulaTaPresoBabaca"
10025,Síntese perfeita da estratégia @ Haddad_Fernando 
10068,"eu vi o seguinte comentário de um menino: ""eu ia votar em Bolsonaro mas agora que Haddad prometeu gás a 49 reais, eu continuo votando em bolsonaro porque eu não acredito em unicórnio"" o filho não acredita em unicórnio mas acredita no DEMÔNIO, o que é pior"
10075,PDT entrando com ação contra a chapa de bolsonaro Ciro voltando correndo da Europa uma pequena chance de um segundo turno entre Haddad x Ciro que país DOIDO
10083,"vamos pensar pelo lado bom: Ana Paula saindo é um voto a mais pro Haddad, Nadja é eleitora de bolsonaro, pode ficar lá até acabar segundo turno # EliminaçãoAFazenda"
10140,"Quando vc vê um jurista votar em um candidato com 32 Processos Judiciais, dae vc vê o nível da Justiça Brasileira... Muito Triste e Lamentável... Amanhã é 17. Capitão, confiamos no @ jairbolsonaro"
10142,"Os postes são=haddad fazer promessas d gás$49,00 para atrair +votos,m fz lembrar da Dilma,na campanha d 2014,fz promessas d não mexer no direito dos trabalhadores,""nem q a vaca tussa""como dizia,q não haveria ""tarifação"".Ganhou eleição,deixou as promessas d lado # bolsonaro17"
10151,"Nenhum candidato é perfeito, sempre falta alguma coisa: - Para o @ cirogomes Ciro falta controle; - Para @ MarinaSilva falta Competência; - Para o @ Haddad_Fernando falta honestidade; - E para o @ jairbolsonaro faltam 3 dias. # NordesteÉ17"
10152,"A campanha não teve a baixaria desejada pelo @ ptbrasil pois @ jairbolsonaro foi abatido em pleno voo e ficou impossibilitado de participar ativamente da campanha. O @ ptbrasil produziu as mais acintosas mentiras contra @ jairbolsonaro e, ainda assim, esta a frente!o povo acordou!"
10153,"Eu ia votar no Bolsonaro no 2° turno, mas o @ Haddad_Fernando Haddad disse na propaganda eleitoral que vai baixar o gás de cozinha para 49,00, então decidi continuar votando no @ jairbolsonaro , pq uma coisa não tem nada a ver com a outra # HoraDaVirada"
10154,"@ RedeGlobo vai dar espaço d(uma hora e quarenta minutos)dia 26/10 sexta-feira, a partir das 22:00, para @ Haddad_Fernando .A desculpa é q o @ jairbolsonaro não quiz participar do debate,Vamos mudar d canal, Compartilhe ""Juntos somos mais fortes"" # bolsonaropresidenteeleito"
10156,"@ Haddad_Fernando quando abriu a Bíblia estava escrito: ""Não darás falso testemunho... Pronto, jogou a Bíblia Fora! # bolsonaropresidenteeleito"
10165,Porque o @ ptbrasil não publicam nada em favor do @ Haddad_Fernando @ ManuelaDavila só contra o @ jairbolsonaro é vergonha de falar que vai votar no @ ptbrasil ?? # AtaqueFakeDoPt
10169,Ja sabemos do plano do @ ptbrasil @ Haddad_Fernando @ ManuelaDavila do atentado contra vocês mesmo pra comoção nacional no intuito de ganhar as eleições. @ ptbrasil jogando sujo para náo perder as eleições # somosbolsonaro17 # AtaqueFakeDoPt
10175,@ jairbolsonaro É melhor ficar em casa do que ir pra debate ouvir as mentiras do Haddad e se sujeitar a ser morto por essa FACÇÃO CRIMINOSA chamada @ ptbrasil
10179,"Eu só vou votar no @ jairbolsonaro pq o @ ptbrasil tirou todo MUNDO da pobreza e esqueceu de mim, muita sacanagem isso!!! # SomosBolsoanro @ Haddad_Fernando"
10183,"O @ ptbrasil @ Haddad_Fernando @ ManuelaDavila agonizam, gemem, gritam, mentem, inventam, tiram as calças pela cabeça e nada dos # patriotas abandonar @ jairbolsonaro # vemprua # ForaPT # PTNuncaMais # Bolsonarosim # Somos1⃣7⃣"
10184,Carreata # próBolsonaro # domingo21 Vamos lá # patriotasl! De verde e amarelo enterrar de vez o @ ptbrasil @ Haddad_Fernando @ ManuelaDavila e seus subordinados.. O Brasil acima de tudo e Deus acima de todos. # somosbolsonaro17 # BolsonaroSim # HaddadNAO
10186,"Não vamos esquecer que @ jairbolsonaro estava entre a vida e a morte pouco + de um mês atrás, por conta do ataque de um psicopata esquerdista. @ jairbolsonaro não perde nada indo ao debate,muito -o Brasil com as mentiras seriais e ataques imundos do @ Haddad_Fernando # BolsonaroSim"
10192,@ Haddad_Fernando PT em desespero as vésperas de eleição atacam a democracia tentando impugnar a campanha do @ jairbolsonaro e inventando muitas mentiras !! Não caiam! # SomosBolsonaro # MarketeirosJair # PatriaAmadaBrasil # Somos17
10195,"O Retaddad @ Haddad_Fernando diz que Bolsonaro criou uma ""organização criminosa nas redes sociais"" sera que estão falando d nós Brasileiros que trabalhamos e pagamos impostos altos # PTNuncaMais # SomosBolsonaro17 # queremosbolsonarobrasildobrasil # CassaçãoDoBolsonaro"
10196,@ Haddad_Fernando tu esta Tá passando vergonha no débito ou no crédito? O povo acordou meu caro! Eu faço propaganda pro @ jairbolsonaro de graça em modo turbo. Só pra ver meu Brasil sem gente como vc no poder! # PTNuncaMais # CassaçãoDoBolsonaro
10200,"@ ptbrasil Com 32 processos nas costas @ Haddad_Fernando está desesperado pra conseguir o foro privilegiado .... Calma ""professor"", breve @ SergioMoroJuiz vai lhe conceder o seu debate.... o povo acordou. Brasil acima de tudo e Deus acima de todos.Somos @ jairbolsonaro"
10201,"@ ptbrasil O desespero bate e agora Haddad e seus seguidores se transformaram da água para o vinho, até a cor da campanha mudaram afim de enganar a população, as calúnias mentirosas e ataques estão a todo vapor para tentar desconstruir a imagem e a candidatura @ jairbolsonaro"
10208,"@ Haddad_Fernando Esses debates só serviu para atacar bolsonaro, para mais nada, o que é que ele vai fazer lá, os eleitores de bolsonaro não tá atrás de debate, quer uma mudança nesse país que está uma bagunça, jogado na criminalidade,BOLSONARO 17"
10214,"votei no amoedo, mas entre haddad e bolsonaro... pt to fora, pego meu bolsonaro e vou embora"
10272,"ai amiga não tem como votar no haddad, é correr mt risco, a rejeição dele disparou pra 38 enquanto bolsonaro tá estável nos 44, votar no haddad é basicamente eleger o coiso"
10285,Vox Populi: Bolsonaro tem 44% contra 39% de Haddad 
10295,"A eleição de Fernando Haddad é fundamental para bloquear esse cenário dantesco. No entanto, a eleição de Haddad não deve suscitar ilusões. A luta das classes trabalhadoras serão mais duras nos próximos tempos. "
10377,"Olha o vídeo q tá rolando no zapzap OFICIAL do Haddad, é de dar nojo. Fizeram um combo de fakenews contra o @ jairbolsonaro e compilaram em 2 e 1/2 minutos. E é esse partido q tá se fazendo vítima de fakenews. Isso sim é uma organização criminosa travestida de partido político.pic.twitter.com/hLvH7rAbyg"
10388,"A campanha do @ jairbolsonaro vai deixar livremente a propaganda do Haddad usar casos de agressão q nem comprovadas foram, e outras comprovadas porém sem autoria ligada ao Bolsonaro, livremente? Mesmo q nenhum desses casos tenham autoria comprovada de apoiadores do Bolsonaro?"
10407,"Pesquisa: Bolsonaro tem 54% dos votos válidos; Haddad, 46% "
10435,"para de se enganar e enganar aos outros, temos 2 opções, haddad, laranja do condenado ou bolsonaro, e é isso, se é 'elenão' é 'haddadsim', assume, fica menos ridículo "
10436,"Diante do cenário q está posto (bolso x haddad, ñ há outra alternativa) significa q vc está + disposta a conviver c/ um partido q destruiu e sangrou o país a conviver c/ bolsonaro q tem lá suas posições controversas, é uma qtão de prioridade, cada um tem a sua... ¯\_(ツ)_/¯"
10464,"Só empate técnico nas simulações de 2º turno do IBOPE. Numericamente, @ jairbolsonaro empatando com Marina e ganhando do Haddad... pic.twitter.com/qBSBcufZod"
10514,Se fosse o lema do bolsonaro vc ia cair de pau não é mesmo? mas como o lema é do Haddad e é apelativo a livros e menos arma vc está adorando né? é comovente não é mesmo? 
10519,TCU - 140 BILHÕES de prejuízo em obras inacabadas é o legado do PT. @ Haddad_Fernando @ gleisi @ ptbrasil @ jairbolsonaro @ BlogdoNoblat @ RevistaISTOE @ reinaldoazevedo 
10542,"@ Haddad_Fernando Haddad, Lula dizia que era só dar uma migalha de reajuste salarial para os Militares e eles paravam de encher o saco, sua política de reajuste salarial para a tropa será a mesma do Lula e da Dilma? vc também vai humilhar salarialmente os Militares @ jairbolsonaro"
10544,"@ Haddad_Fernando se vc chegar a Presidência, continuará sacrificando os salários dos Militares das Forças Armadas para os programas sociais como o Lula e a Dilma sempre fizeram? @ gleisi @ ManuelaDavila @ jairbolsonaro"
10545,"Haddad, se vc chegar a Presidência, os Oficiais Superiores só chegarão ao Generalato se estiverem alinhados com a ideologia filosófica do PT ? @ Haddad_Fernando @ gleisi @ ManuelaDavila @ jairbolsonaro"
10546,"Haddad, caso vc ganhe as eleições, vc vai continuar a Política de ""BAIXOS SALÁRIOS HISTÓRICOS"" das Forças Armadas iniciada pelo @ FHC e perpetuada pelo Lula e Dilma? vai sucatear nossos meios operacionais? @ Haddad_Fernando @ ptbrasil @ ManuelaDavila @ jairbolsonaro @ gleisi"
10550,@ Haddad_Fernando @ gleisi @ ptbrasil @ STF_oficial @ TSEjusbr @ jairbolsonaro @ Francischini_ @ folha @ VEJA @ OGloboPolitica @ GloboNews Olha o pronunciamento do Deputado do PT de quem não respeita Juiz!
10554,"@ Haddad , quer saber por quê os Americanos querem uma Base no Brasil? simples, porquê a China está montando uma base na Argentina! PORRA! @ jairbolsonaro"
10560,"@ Haddad @ Gleisi @ ptbrasil @ jairbolsonaro @ BlogdoNoblat Haddad tem que ser processado com base no ECA, acusou um garoto de 16 anos de ser torturador! depois acusa Bolsonaro por Fake News ? kkkkkkkkkkkkkkkkkkkkkkkkkkkkkkkkkkk "
10574,"O ENSINO A DISTÂNCIA ajudou a família SCHURMANN, mas o Haddad é contra! kkkkk @ Haddad_Fernando @ bolsonaro @ ManuelaDavila @ folha @ VEJApic.twitter.com/14DuVgd7Eo"
10584,"O PT é capaz de assassinar o Haddad culpando o Bolsonaro, para conquistar votos e substituí-lo pela Manuela! eles já disseram que fariam o Diabo, por quê o Lula escolheu logo um POSTE para substituí-lo? teoria da conspiração ou fato? "
10585,"@ Haddad_Fernando , Haddad, cuidado com o seu próprio Partido, eles podem assassiná-lo para levantar votos para o PT culpando o Bolsonaro, e assim levando a Manuela para a Presidência e conquistando novamente o poder! @ jairbolsonaro @ anaamelialemos @ JoseMedeirosMT"
10586,"O PT não aceita derrota, até o dia 28 vai mostrar sua verdadeira cara! ...mentiras e simulações pesadas poderão ser produzidas pelo PT nos próximos dias! @ Haddad_Fernando @ ManuelaDavila @ ptbrasil @ jairbolsonaro"
10587,"..isso é o plano do Haddad, digo do Lula, ou será do PT, sei lá, mas não é do bolsonaro! "
10588,"Só foram lá para dar a ESTREMA UNÇÃO do PT, isso não se nega pra quem já está no leito de morte! @ gleisi @ ptbrasil @ Haddad_Fernando @ ManuelaDavila @ jairbolsonaro"
10599,"@ TSEjusbr Olhas só a FAKE NEWS que o candidato HADDAD está espalhando, tomem providências! @ Haddad_Fernando @ gleisi @ ptbrasil @ jairbolsonaro"
10603,"@ Haddad_Fernando @ ManuelaDavila @ ptbrasil @ PTnaCamara @ gleisi @ LulaOficial @ jairbolsonaro @ BlogdoNoblat Isso é que eu chamo de ""implosão"" kkkkkkkkkkkkkkkkkkkkkkkkkkkkkkkkkkkk"
10604,@ Haddad_Fernando @ ManuelaDavila @ jairbolsonaro @ Francischini_ @ MagnoMalta Tem que expor e disponibilizar link para download PDF e dar acesso a todos!
10605,"Olha aí, pede respeito e depois sai espalhando FAKE NEWS, esse mentiroso jogando sujo com mentiras, é a cara do PT ! @ Haddad_Fernando @ ManuelaDavila @ jairbolsonaro @ BlogdoNoblat @ reinaldoazevedo @ VEJA @ exame @ alexandregarcia @ augustosnunes @ KatiaAbreu"
10606,@ Haddad_Fernando @ jairbolsonaro Como votar num candidato que foi taxado péssimo Prefeito?
10608,"ENSINO Á DISTÂNCIA HADDADE ESTÁ ERRADO, BOLSONARO ESTÁ CERTÍSSIMO! Vocês conhecem a ""Família Schürmann (navegadores)""? família Bueno? com eles deu certo, como tem dado certo no mundo inteiro COM MILHÕES DE FAMÍLIAS! @ Haddad_Fernando @ ManuelaDavila @ jairbolsonaro"
10690,"@ joicehasselmann Paulo Quilombola denuncia que @ jairbolsonaro corre risco de ser assassinado no Hospital Albert Eintein, deveria ficar em hospital militar, diz que milhões de Euros sujos estão vindo da áfrica de países que receberam dinheiro do BNDES por mar e ar financiar Haddad"
10699,"Lixo !! Comunista esquerdista socialista e sempre um lixo !!!!!!! Todas !!! Sem exceção !!!! Até vc que vota neles !!!!!! Só pra vc saber , feiosa ! @ Haddad_Fernando eca ! @ jairbolsonaro ela é linda !pic.twitter.com/7xUWEM7Jxn"
10898,Bolsonaro propõe menos direitos trabalhistas; Haddad quer revogar reforma de Temer. Veja as propostas 
10913,"Somente Haddad pode defender nossa democracia, que está ameaçada. "
10920,Globo estuda púlpito vazio caso Bolsonaro fuja de debate com Haddad | Blog do Esmael 
10933,"Bolsonaro está mais próximo da Venezuela do que Haddad, diz pesquisadora "
10934,Médicos vetam ida de Bolsonaro a debates; Haddad diz que vai até enfermaria 
10947,"No segundo turno, Bolsonaro perde para Haddad, Ciro e Alckmin, diz pesquisa Ibope "
10988,Datafolha: Rejeição a Bolsonaro sobe após atentado. Haddad ultrapassa Bolsonaro no 2o. turno. Haddad foi o q mais cresceu após atentado.... 
11021,"Que vergonha a edição do JN , mostrando Haddad, claramente parcial, não escondeu a preferência., mostrou aliança, Haddad tocando Violão, piano, filhos, multidão kkkkk tudo paz ,amor e família. É uma manipulação que dá nojo. Mas não colou @ RedeGlobo . Vai dar @ jairbolsonaro"
11023,Tô preocupada...... @ jairbolsonaro está crescendo tanto nas pesquisas que não vai sobrar votos para o @ Haddad_Fernando ...que triste né? # SQN kkkkkk.
11034,"# SuasticaFake queremos direito de resposta para nosso presidente @ jairbolsonaro, já que o Sr. @ Haddad_Fernando promoveu este Fake em seu programa eleitoral. @ TSEjusbr queremos justiça"
11051,"Ao vivo. Mostrando quem são os ""pastores"" que apoiam Haddad. @ jairbolsonaro "
11060,Isso é CAIXA  PROVAS. E assim que HADDAD TRABALHA ACUSA SEU ADVERSÁRIO DAQUILO QUE ELE FAZ. # MARKETEIROSDOJAIR
11062,"O PT está fazendo uma campanha super negativa, ""fakeando torturas"".O povo já entendeu q foram pontuais. Existem @ Haddad_Fernando várias formas de torturar pessoas e uma nação inteira o PT fez isso, e dia 28 nos libertarmos dessa tortura moral com @ jairbolsonaro # Presidente17"
11063,"O Programa do @ Haddad_Fernando é agressivo e tem a intenção de assustar os eleitores.Péssimos Marketeiros, com tanta violência sofrida na era PT, o povo que já não mais se ilude,tendem a rejeitar os exageros dos autores,não o concorrente. @ jairbolsonaro # PsicólogiadeMaketing."
11064,Bolsonaro ( @ jairbolsonaro) deve participar de debates com ( @ Haddad_Fernando )
11068,"Com cerca de 32 processos, denuncias de caixa 2 ( de verdade) você quer proibir o povo Brasileiro de fazer campanha, marketing de GRAÇA para @ jairbolsonaro . É muita cara de pau, comunicação ardilosa,manipulação doentia @ Haddad_Fernando . "" O Lula tá preso Babaca"" ..... pic.twitter.com/JGqMWUFpdi"
11070,"Psicóloga lança nota de repúdio contra Haddad por tentar ""manipular os evangélicos"" @ jairbolsonaro "
11075,"Meu Deus que absurdo @ Haddad_Fernando usar a mentira da Tortura, agressões mentirosas, no seu ""Fake programa"" eleitoral.Como vocês são odiosos . Graças a Deus o @ jairbolsonaro vai ganhar eleição e ""metralhar"" moralmente todos vcs."
11078,"Francamente @ Haddad_Fernando até tentei assistir seu programa eleitoral.Mas, só tem mentiras, fakes e imitação barata do @ jairbolsonaro bandeira do Brasil em entrevistas? Linguagem de sinais ao vivo? Viu, como BOLSONARO É LIDER? Até você copia kkk"
11079,"O tal @ Haddad_Fernando é uma piada.É um Fake combatendo fakes, e é uma cópia muito mal feita do @ jairbolsonaro coloca até bandeira do Brasil atrás ( para parecer patriota), uma pessoa fazendo linguagem de sinais.Imitação barata.O cara é um fake, e genérico. Vote no original B17."
11080,A rejeição de Haddad dobrou em SP. É B17 na cabeça. 
11089,A VERDADE SOBRE O KIT GAY. HAddad é o não é opai do Kita Gay. @ jairbolsonaro @ opiniaocritica1 
11102,"To ficando preocupado com @ Haddad_Fernando quase meio dia e ainda não soltou nenhuma # FakeNews não deu nenhuma escorregada ainda, será que finalmente tá reconhecendo sua derrota para o @ jairbolsonaro ?"
11106,Qdo vc vê a # vejalixo a # folhalixo a # Globoelixo o @ FHC # PT # HADDAD # LULA e muitos outros falando mal de @ jairbolsonaro vc vê que está indo no caminho certo.
11132,"A mídia é 100% @ geraldoalckmin, até agora escolheu ficar do lado de @ Haddad_Fernando , porque é mais forte para tirar @ jairbolsonaro do que o seu próprio candidato, mas no segundo turno vira o jogo e # Haddad será o massacrado pela # midiagolpista ."
11133,Só pra lembrar vc que espera 16 anos para sair da pobreza e tá pensando em votar no # Haddad a nossa única esperança é @ jairbolsonaropic.twitter.com/wUv3IdJJsB
11302,"Haddad é retroceder a corrupção, o momento é restabelecer o pleno crescimento da economia. "
11308,"Bolsonaro lidera corrida Presidencial com 28,2% O Haddad, do Kit Gay para educar seu filho (a), nas escolas infantis, tem um pouco mais dessa metade. "
11309,"""Haddad 13"", autor da cartilha gay para crianças nas escolas, sendo impedida sua implementação, PELO NOSSO FUTURO PRESIDENTE BOLSONARO, faz William Bonner, fazer campanha para Bolsonaro, em horário destinado a ele... # bolsonaro17 "
11331,Depois dessa @ jairbolsonaro só não se cagou porquê está colostomizado! Esse palhaço está possuído pelo Ciro Gomes? Sai desse corpo que não te pertence! # BolsonaroSim
11332,"É o mínimo que se espera deles! @ jairbolsonaro tem que processar Haddad e essa ""jornalista"" @ camposmello por calúnia e difamação. Ou jornalista também está acima do bem e do mal e pode sair por aí inventando mentiras? # MarketeirosDoJair # MarqueteirosDoJair # BolsonaroSim"
11338,"Isso aí! Estimulem bastante a violência! Melhor trecho: ""Bolsonaro:- Deus acima de tudo..."" Haddad: - Vai para o inferno!"" Precisa dizer mais alguma coisa? Depois imputam a culpa no @ jairbolsonaro Ainda dá tempo de tirar esse vídeo! Corre, vai! # BolsonaroUnindoOBrasil"
11342,"Basta ler o plano de governo do Haddad (Lula) para ter certeza que a Justiça para eles tem que ser aparelhada, como tudo no governo deles. "
11410,"Novo Datafolha sendo divulgado agora. Bolsonaro segue liderando primeiro turno, mas longe de evitar o segundo. Haddad e Ciro brigam de foice pela segunda posição. Mas, é em 7 de outubro que a verdade vira à tona. "
11412,"Marina perde votos para Ciro e Haddad, que apresenta crescimento considerável. Lembra o duelo Lula x Brizola, em 1989, pelo segundo turno contra Fernando Collor. "
11420,"@ OEA_BR @ gerardodeicaza @ TSEjusbr @ exercitooficial @ policiafederal @ lobaoeletrico @ luciano_hang Cadê o encontro com Lider nas Pesquisas @ jairbolsonaro , encontro somente com Haddad?????? Bando de dissimulado! NÃO VAI TER FRAUDE!!!! ESTAMOS DE OLHO! O BRASIL QUE TRABALHA ACORDOU!"
11421,"@ Laura_Ch @ OEA_BR @ gerardodeicaza @ TSEjusbr @ exercitooficial @ policiafederal @ lobaoeletrico @ luciano_hang Cadê o encontro com Lider nas Pesquisas @ jairbolsonaro, encontro somente com Haddad??Bando de dissimulado! NÃO VAI TER FRAUDE! ESTAMOS DE OLHO! O BRASIL QUE TRABALHA ACORDOU!"
11422,"@ OEA_BR @ gerardodeicaza @ TSEjusbr @ exercitooficial @ policiafederal @ lobaoeletrico @ luciano_hang Cadê o encontro com Lider nas Pesquisas @ jairbolsonaro , encontro somente com Haddad?????? Bando de dissimulado! NÃO VAI TER FRAUDE!!!! ESTAMOS DE OLHO! O BRASIL QUE TRABALHA ACORDOU!"
11423,"@ OEA_BR @ gerardodeicaza @ jairbolsonaro @ TSEjusbr @ exercitooficial @ policiafederal Cadê o encontro com Lider nas Pesquisas @ jairbolsonaro , encontro somente com Haddad????????? Bando de dissimulado! NÃO VAI TER FRAUDE!!!! ESTAMOS DE OLHO! O BRASIL QUE TRABALHA ACORDOU!"
11424,"@ jairbolsonaro @ TSEjusbr @ exercitooficial @ policiafederal @ lobaoeletrico @ luciano_hang Cadê o encontro com Lider nas Pesquisas @ jairbolsonaro , encontro somente com Haddad????????? Bando de dissimulado! NÃO VAI TER FRAUDE!!!! ESTAMOS DE OLHO! O BRASIL QUE TRABALHA ACORDOU!"
11472,"Idem Já carreguei o arrependimento do Lula , Dilma e Haddad, agora tentei com o Álvaro, não deu, agora e por eliminação, tem muita coisa no @ jairbolsonaro que não gosto, mas do lado do PT e difícil achar o que presta, só tem jogo sujo,"
11481,Coloca o @ jairbolsonaro nas suas publicações aí acho que talvez ele responda
11525,"""Bolsonaro entra com ação no TSE contra Haddad, acionistas da Folha e repórter"" "
11530,TSE manda filho de Bolsonaro tirar do ar fake news contra Haddad 
11535,"Haddad, Ciro e Alckmin vão ao TSE para impedir entrevista de Bolsonaro a Record (que deve ir ao ar durante o debate na Globo) "
11538,"Haddad: “São milhões de mensagens mentirosas por dia e faz uma semana que isso vem acontecendo. É muito difícil conter essas mentiras porque, por exemplo, o Twitter é público, (...) No WhatsApp, não tem como correr atrás com a mesma eficiência"". "
11541,"No segundo Ibope da semana nada mudou substantivamente: Bolsonaro tem 27%; Haddad, 21%; Ciro, 12%; Alckmin, 8%; e Marina, 6% via @ UOLPolitica @ UOL"
11545,Ibope: Haddad cresce 11 pontos e se isola no segundo lugar; Bolsonaro mantém liderança @ estadao:
11706,"Espero de TODO coração que dê Ciro e bolsonaro. E espero mais ainda que o Ciro ganhe! O Brasil NÃO quer Haddad, não adianta."
11752,"Estou em um hospital (Público) com minha filha, é incrível ouvir as pessoas dizendo que vão votar no Haddad, porque o Bolsonaro vai dar armas pra todos. Estão na fila pra tirar Raio x desde 5 da manhã, e o problema é o porte de arma do @ jairbolsonaro. Lamentável!"
11756,Assistindo a entrevista de @ jairbolsonaro e @ Haddad_Fernando no @ conexaoreporter fica claro que o PT acabou. O Haddad não responde um pergunta sem acusar os outros. Só dá respostas evasivas.
11757,"Faça o seguinte Haddad, como disse o General Ajax, tome uma facada, perca 2LT de sangue, fique quase 30 dias internado, carregue uma bolsa de colostomia. Somente aí vc estará pronto pra debater com o @ jairbolsonaro. Vai procurar ganhar sem baixeza."
11761,"@ merval_merval “Haddad precisa tirar 1M de votos por dia de algum lugar, e torcer para @ jairbolsonaro cometer algum deslize e regredir. Senão não vai ganhar”. Ou seja A ESPERA DE UM MILAGRE! # PTnãopic.twitter.com/VkT9kR0wK4"
11769,"Segundo ibope @ jairbolsonaro perde no segundo pra Haddad, estão planejando o fim do Brasil. Realmente estou preocupado. Oremos!"
11789,bolsonaro subiu quatro haddad estabilizou e desceu ciro e alckmin estáveis empatados nem a btg previu isso. oq tá axontecendo???
11791,"eu não acredito que bolsonaro vá despencar, vai perder de subir pq n aparece, mas acho que ele vai ficar aí por volta dos 20 consolidado mesmo aparecendo bem menos agora. tb nao acredito que haddad vá crescer muito mais que isso. de que forma isso não faz sentido? n entendi"
