25,"Eu não tinha interesse em ver @ jairbolsonaro frente contigo, ele tem muito valor e você, um vagabundo meia boca não merece a atenção de uma pessoa valiosa como Bolsonaro."
103,"# AmanhaBolsoDoria Datafolha para presidente, votos válidos: Bolsonaro, 55%; Haddad, 45% "
104,"Bolsonaro entra com ação no TSE contra Haddad, acionistas da Folha e repórter "
112,"Contra Bolsonaro, Haddad posta vídeo de criança atirando no pai "
113,Ministro dá andamento a ação de Bolsonaro que pede ao TSE para declarar Haddad inelegível 
121,Prisão mais rígida opõe Bolsonaro e Haddad - ISTOÉ Independente 
128,Haddad: Bolsonaro 'vai tomar uma surra do povo brasileiro no domingo'  via @ YahooBr
130,"# bolsonaropresidenteeleito # nãoaceitaremosfraude Instituto Paraná Bolsonaro tem 69,1% contra 30,9% de Haddad das intenções de voto em SP - RecordTV - R7 Jornal da Record  # R7 via @ portalr7"
132,"Em São Paulo, Bolsonaro vence Haddad por 64% a 36%, diz Ibope @ estadao:"
135,"Na cidade de SP, Haddad aparece numericamente à frente de Bolsonaro "
141,"Com ordens de dentro da cadeia, Haddad diz que Bolsonaro 'precisa ser varrido da face da Terra'  via @ SITEFCS"
160,Pesquisa CNT/MDA: Bolsonaro lidera com 57% de votos válidos; Haddad tem 43%  via @ UOLNoticias # UOLnasUrnas # informacaocontraoAchismo
168,# EAgoraTSE Caixa 2: TRE apreende jornais com fake news a favor de Fernando Haddad e contra Jair Bolsonaro na sede do Sindipetro em Macaé –  … # NasRuasComBolsonaro
173,"# NasRuasComBolsonaro // @ conexaopolitica Sem palavras, só divulgue para seus contatos e peçam para que todos façam o mesmo simultaneamente e daqui um minuto está mensagem estará nos quatros cantos da terra. @ jairbolsonaro # HaddadNaCadeia @ Haddad_Fernando pic.twitter.com/RU6tY93erk "
174,# NasRuasComBolsonaro ... Caixa 2: TRE apreende jornais com fake news a favor de Fernando Haddad e contra Jair Bolsonaro na sede do Sindipetro em Macaé 
175,Caixa 2: TRE apreende jornais com fake news a favor de Fernando Haddad e contra Jair Bolsonaro na sede do Sindipetro em Macaé 
178,"'Se desligar o WhatsApp por cinco dias, o Bolsonaro desaparece', diz Haddad  via @ redebrasilatual"
182,FPE visita Bolsonaro e diz que vitória de Haddad é perigo para liberdade religiosa 
191,"Datafolha: Bolsonaro cresce ainda mais, Haddad perde votos  via @ republica_ctba"
204,# BastaDePT ''A explicação do porque Haddad tenta a todo custo se transformar num camaleão!'' pic.twitter.com/yIGHYbpmE6 
226,Como eleição de Haddad ou Bolsonaro pode mudar os rumos do STF  via @ UOLNoticias # UOLnasUrnas # informacaocontraoAchismo
227,Irmão de Ciro reclama de Bolsonaro e reforça voto em Haddad  via @ UOLNoticias # UOLnasUrnas # informacaocontraoAchismo
229,Bolsonaro e Haddad voltam a ter desavenças em mensagens no Twitter  via @ UOLNoticias # UOLnasUrnas # informacaocontraoAchismo
236,Vaza áudio de Susana Vieira falando barbaridades sobre Haddad e Bolsonaro; ouça 
237,Ibope: Bolsonaro lidera entre ricos e evangélicos; Haddad vence no NE  via @ UOLNoticias # UOLnasUrnas # informacaocontraoAchismo
238,"Ibope: No 2º turno, Bolsonaro tem 59% dos votos válidos e Haddad, 41% - ISTOÉ DINHEIRO "
252,"Não, Haddad não... @ jairbolsonaro , @ CarlosBolsonaro , @ FlavioBolsonaro e @ BolsonaroSPpic.twitter.com/Hndoj4phKA"
271,"Manuela, vice de Haddad, exige que Bolsonaro saía das redes, ‘onde o povo não pode comparar’  via @ Blog_Cesar_Weis"
273,"Manuela, vice de Haddad, exige que Bolsonaro saía das redes, ‘onde o povo não pode comparar’ "
304,"é sim, mas ele não tá fazendo campanha pra ninguém. está só se manifestando contra o fascismo e bolsonaro. nem menciona o nome do haddad"
373,Mídia ignora morte de eleitor de Bolsonaro que foi assassinado por recusar material de Haddad 
378,"Preparação para falso atentado? PT já culpa Bolsonaro ""se algo acontecer"" com Haddad ou Lindbergh – Senso Incomum "
380,Bolsonaro diz que não votou contra deficientes e acusa Haddad de mentir 
389,"'Se desligar o Whatsapp por cinco dias, o Bolsonaro desaparece', diz Haddad "
391,Jornalista que mentiu sobre ex-mulher de Bolsonaro é filha de petista aliado de Haddad 
392,Verba eleitoral de Haddad é cinco vezes maior que a de Bolsonaro no 2º turno 
410,TSE remove inserção de Haddad com informação falsa sobre Bolsonaro 
413,Bolsonaro rebate mais uma fake news criada por Haddad 
440,Jornalista que mentiu sobre ex-mulher de Bolsonaro é filha de petista aliado de Haddad 
455,Quem votou a favor da PEC dos gastos foi o bolsonaro
473,"E dai se é fantoche? A Lei proíbe debater? Pq o @ jairbolsonaro não aproveita a oportunidade pra desmarcar o PT? Vai que ele prova aos eleitores petistas que estão sendo enganados pelos corruPTos, ou será que na verdade Bolsonaro está com medo de perder seus eleitores menos burros"
496,"Tinha LulaLivre, tinha Ciro, tinha Haddad, tinha Amoedo, tinha # todoscontrabolsonaro menos # EleNao"
571,Parabéns ao @ jornalnacional pelo tempo de reportagem do @ Haddad_Fernando isso mostra o quanto estão preocupados com a vitória de @ jairbolsonaro sempre
580,São Luís é # bolsonaro2018
662,"João Gordo sempre se declarou anarquista e, agora, se posiciona contra o fascismo! # ViraVoto # HaddadSim # Democracia # B17 # bolsonaro # Caixa2DoBolsonaro # Haddad13 # Haddad # HaddadPresidente # Haddad2018EuVoto # H13... "
663,Para você que diz lutar pela decência e transparência... # ViraVoto # HaddadSim # Democracia # B17 # bolsonaro # Caixa2DoBolsonaro # Haddad13 # Haddad # HaddadPresidente # Haddad2018EuVoto # H13 # Eleições2018 # FechadoComHaddad... 
664,"""Nova pesquisa Vox Populi confirma tendência de crescimento de Haddad e queda de Bolsonaro; nos votos totais, considerando brancos e nulos, o petista e o capitão da reserva também... "
665,Oposição se faz com democracia! # ViraVoto # HaddadSim # Democracia # B17 # bolsonaro # Caixa2DoBolsonaro # Haddad13 # Haddad # HaddadPresidente # Haddad2018EuVoto # H13 # Eleições2018 # FechadoComHaddad # FernandoHaddad... 
666,Ouçam o exercício da democracia e respeito ao eleitor! # B17 # bolsonaro # Caixa2DoBolsonaro # Haddad13 # Haddad # HaddadPresidente # Haddad2018EuVoto # H13 # Eleições2018 # FechadoComHaddad # FernandoHaddad # HaddadPresidente2018... 
668,Bozo é defenestrado até entre antipetistas convictos... # B17 # bolsonaro # Caixa2DoBolsonaro # Haddad13 # Haddad # HaddadPresidente # Haddad2018EuVoto # H13 # Eleições2018 # FechadoComHaddad # FernandoHaddad... 
669,"""Mas eu particularmente acho que a relação das pessoas com os livros ajuda a definir o caráter."" # B17 # bolsonaro # Caixa2DoBolsonaro # Haddad13 # Haddad # HaddadPresidente # Haddad2018EuVoto # H13 # Eleições2018... "
670,"Vamor # VirarVoto e comemorar o Brasil da diversidade, da democracia! # B17 # bolsonaro # Caixa2DoBolsonaro # Haddad13 # Haddad # HaddadPresidente # Haddad2018EuVoto # H13 # Eleições2018 # FechadoComHaddad # FernandoHaddad... "
671,Vamos conversar?! # ViraVoto # B17 # bolsonaro # Caixa2DoBolsonaro # Haddad13 # Haddad # HaddadPresidente # Haddad2018EuVoto # H13 # Eleições2018 # FechadoComHaddad # FernandoHaddad # HaddadPresidente2018 # Brasil13... 
672,"Obrigado, pela declaração e apoio, Joaquim Barbosa. O meu compromisso é defender um Brasil de todos e todas. # ViraVoto (Fernando Haddad) # B17 # bolsonaro # Caixa2DoBolsonaro # Haddad13 # Haddad # HaddadPresidente... "
673,É tudo da boca pra fora... # B17 # bolsonaro # Caixa2DoBolsonaro # Haddad13 # Haddad # HaddadPresidente # Haddad2018EuVoto # H13 # Eleições2018 # FechadoComHaddad # FernandoHaddad # HaddadPresidente2018 # Brasil13... 
674,"A gente tem que se posicionar, a gente tem que garantir a nossa jovem democracia... # B17 # bolsonaro # Caixa2DoBolsonaro # Haddad13 # Haddad # HaddadPresidente # Haddad2018EuVoto # H13 # Eleições2018 # FechadoComHaddad... "
697,"Há gráficos falsos de pesquisas circulando, dando um quase empate de Haddad. Não acredite. Essas pesquisas não existem. Não passam de mais uma fraude da facção, liderada de dentro da cadeia. Os números da última pesquisa são: @ jairbolsonaro - 60,6% @ Haddad_Fernando - 39,4%"
700,"Pesquisa da Paraná Pesquisas/Crusoé-Empiricus desmente as manipulações do DataFolha e do Ibope. Em votos válidos @ jairbolsonaro tem 60,6% @ Haddad_Fernando tem 39,4% Ao contrário da narrativa petista (fomentada por Ibope e Data Folha) Haddad permaneceu parado e Bolsonaro não caiu."
701,"Nenhuma! Quem é capaz de acreditar nessa pesquisa? Analisem: @ jairbolsonaro tem no Estado de São Paulo, 71% dos votos válidos contra 29% de @ Haddad_Fernando. Mas Haddad, na cidade de São Paulo, tem 51%, numa discrepância total... e quando no 1º turno teve 19,7%!? Manipulação."
704,"O IBOPE PERDEU O PUDOR Quem é capaz de acreditar na pesquisa manipulada do Ibope? Analisem: @ jairbolsonaro tem no Estado de São Paulo, 71% dos votos válidos contra 29% de @ Haddad_Fernando. Mas Haddad, na cidade de São Paulo, tem 51%... quando no 1º turno teve 19,7%!? # IbopeFake"
708,"Saiu mais uma manipulação do Ibope, fazendo o @ jairbolsonaro cair e o @ Haddad_Fernando subir. Quem acredita ainda em pesquisas de Institutos que cometeram erros crassos... e culparam o Whatsapp? Cuidado com as manipulações. O ""mecanismo"" está dando seus últimos extertores!"
714,"A @ folha é uma empresa; ao difundir notícias falsas, sem qualquer prova, contra a candidatura de @ jairbolsonaro, beneficiando @ Haddad_Fernando, não está cometendo crime eleitoral de abuso de poder econômico? Com a palavra os especialistas!"
715,"GRAVES AMEAÇAS! @ Haddad_Fernando ameaça a Justiça e o processo eleitoral e proclama: ""Independentemente do que a Justiça fizer, independentemente do que acontecer nas próximas semanas, essa crise só termina com o Lula na Presidência"", E aí @ TSEjusbr ? # CensuraPetista"
731,"O @ Haddad_Fernando declarou ao jornal El Pais, da Espanha, que @ jairbolsonaro ""é o cara mais baixo que eu conheci na vida pública"". Falou o homem que foi denunciado pelo MP por corrupção, lavagem de dinheiro e formação de quadrilha e que é orientado na campanha por um presidiário"
746,"O nível da mídia: 1 - @ Haddad_Fernando é a marionete de um criminoso, que da cadeia comanda a campanha eleitoral e sobre o qual pesam denúncias e processos sem fim. Silêncio! @ jairbolsonaro é candidato sem envolvimento com crimes na política, com uma separação judicial. Gritaria!"
751,Curiosidades! Haddad e Alckmin são mais rejeitados do que @ jairbolsonaro !
754,"Saíram os resultados de uma nova pesquisa, exclusiva da @ RevistaCrusoe @ jairbolsonaro aparece com 26,6% do eleitorado, com mais do que o dobro dos votos de Ciro Gomes e Marina Silva. E mais do que o triplo de Geraldo Alckmin e Fernando Haddad. "
800,"o processo dele segue, querido. haddad é réu em 32 processos. já Bolso: "
810,"e onde bolsonaro foi citado na Lava Jato? ah já sei ele foi citado como deputado q ñ aceitou dinheiro até pelo ex-ministro Joaquim Barbosa e delatores. Já Haddad foi denunciado pelo MP por corrupção, lavagem de dinheiro e formação de quadrilha"
840,"não vou ficar discutindo mais sobre kit gay com vc, pq já foi vetado, a eleição ñ é sobre kit gay, e o MEC partiu, se foi haddad ou ñ q fez, ñ interessa mais. haddad espalhou até q bolsonaro qria mudar a nossa senhora aparecida e qr falar de fake news. pura hipocrisia"
841,"ñ votei nele no 1 turno, votarei agora,pq ñ acredito q um partido q jogou o país na cride economica e política vai salvá-lo, bolsonaro ñ sei, veremos, só qndo ele se eleger; mas o PT é óbvio q ñ vai, pq ele q criou o problema, foi dilma q levou o país, a crise."
849,"assinou, te mandei o link cara, o PT foi o unico partido a não assinar, todos os outros assinaram. vc tá falando da reunião q teria com haddad e bolsonaro hj com TSE, bolsonaro pediu pra adiar a reunião, só isso."
857,"fez quase nada, na real, 50% é mediocre, Paes aq no Rio com tudo q sofreu, fez 84%, Dino lá no Maranhão (como já disse minha família tem origem lá) fez 94%. bolsonaro teve 600 projetos de lei, mas mt barrados, obvio. ñ votei nele no 1 turno, mas votarei agora pra barrar o PT"
887,"a campanha do bolsonaro nem usa fundo partidário praticamente. bolsonaro gastou 1 milhão de dinheiro público, haddad gastou 20 milhões."
926,"E bandidos, em geral, preferem Haddad: "
928,"querida, ""apoio"" no 2 turno é apenas declaração de votos, eles não fazem parte do governo nem da coligação de bolsonaro, largue de ser hipocrita."
934, Não esqueça dos presidiários fãs do Haddad
936,Acho q qm se envolve com bandido é o Haddad: 
938,"Se vc conceitua alguém por votos q ela recebe, Haddad é um bandido de primeira estirpe, já que os presidiários o amam. "
942,"o q tu uma coisa a ver com outra?  nessa lógica, haddad é bandido"
944,"por essa lógica, haddad é um bandidao de 1 linha, pq a cadeia ama ele. "
945,"por essa lógica, Haddad é uma bandidao de 1 linha, pq a cadeia ama ele. "
951,"votei no ciro contra a polarização, mas já q não deu, escolhi meu lado na polarização. dizm q ele é ditatorial, mas qm tm no plano de governo, regulação da mídia é haddad. ademais, já sabemos o ministro da fazenda de bolsonaro. e de haddad? cheque em branco, mais crise como dilma"
957,"se vc é de alguma capital do nordeste, a chance de ter votado em bolsonaro é 90%, já q a vantagem de haddad só veio no interior."
958,"De fato, foi algo inédito no Nordeste, Haddad só ganhou em 3 de 9 capitais de NE (São Luís, Teresina e Salvador; sendo q em São Luís, a diferença entre os 2 foi de 1% apenas). no resto, deu bolsonaro; sendo q em Recife, Maceió, Aracaju, João Pessoa e Natal; ele levava no 1 turno."
1104,"Oh Haddad e Ciro venham salvar o segundo turno, venham! # Caixa2bolsonaro"
1166,Penso igual Bolsonaro e apoio ele...Você é um idiota não sabe bem o que diz.... # bolsonaro17
1176,"Ibope: Jair Bolsonaro registra 54% dos votos válidos e Haddad, 46%  via @ cartacapital"
1200,"Datafolha: Bolsonaro tem 28%; Haddad registra 22% e Ciro, 11%  via @ cartacapital"
1234,"Meia dúzia de gatos pingados, se comparado com a do bolsonaro"
1282,no 1° turno a pesquisa # VoxPopuli foi a que mais se aproximou ao resultado. / Vox Populi mostra empate exato de 50% entre Bolsonaro e Haddad | GGN - 
1287,"Bolsonaro e Haddad estão tecnicamente empatados no 1º turno, mas petista vence no 2º, diz pesquisa "
1291,"tadinha da # Miriam / Tutelada pela Globo, que a pôs de joelhos diante de Bolsonaro, Miriam Leitão “denuncia” a tutela de Haddad. Por Kiko Nogueira "
1412,"Falar uma coisa dessas mostra que isso não é demência, mas sim mal caratismo... Uma matéria veiculada por alguém que é assumidamente petista, sem provas, prontamente refutada pelas empresas citadas e pelo candidato @ jairbolsonaro , sem UMA evidência sequer... E você fala isso?"
1491,globo mostrando a semana de haddad: mil coisas campanha do bolsonaro: to com bolsa de cocô aqui talkei
1495,"não vou passar pano pra uma omissão desse tamanho marina, joaquim barbosa, até o goldman deram declarações mais enérgicas e se ia cair a boca falar vota no haddad ele no mínimo tinha que ter feito aqueles vídeos destroçando o bolsonaro com toda a retórica que ele tem"
1503,em são paulo capital o ibope aponta haddad vencendo bolsonaro por 51x49 candidato petista vencendo em são paulo capital no auge do antipetismo o reconhecimento da administração haddad tardou mas chegou
1504,chegar no meu ouvido assim e falar tá conversando besteira de votar em bolsonaro ele não gosta de mulher de sapatão nem de viado por isso eu sou mais humilde eu vou votar em HADDAD HADDAD HADDAD
1506,"aqui no brasil tem haddad, que ficou até sábado em SP dando entrevista pra blog e lacrando no twitter aqui no brasil tem breno altman, que deixou claro q o sonho do pt era ir com bolsonaro pro segundo turno aqui no brasil tem partido que pariu mateus e quer fazer ciro balançar "
1511,"ah, os refrescos ciro vem denunciando o fascismo há mais de dois anos e foi o ÚNICO presidenciável a sistematicamente chamar bolsonaro do que ele é: fascista, nazista, neonazista mas ele entregou o país pros fascistas quem luta contra é haddad que só começou a atacar há 15 dias "
1527,"bolsonaro perdeu pro haddad em capelinha nordeste e vale do jequitinhonha, salvem o brasil"
1530,falta muita força no haddad esse segundo turno é quase caso perdido o marketing petista vai ter que ser irretocável e bolsonaro vai ter que errar muito pra gnt não cair no abismo
1533,"sobre uma eleição ocorrendo sob um golpe de estado: não há regras, pq não há lei band, redetv e agora, no caso mais gritante e absurdo, record, fazendo campanha aberta pra bolsonaro e nada faz o tse fosse ciro ou marina certamente proibiriam se fosse haddad mandariam prender"
1546,rejeição do haddad cresceu 11 PONTOS e já tá quase empatado com bolsonaro IMPOSSÍVEL que vcs vão cometer a CRETINICE de levar esse cara pro segundo turno
1548,"realmente é MUITO diferente a proposta do mourão pra do haddad que vai colocar frota, kataguiri, cabo daciolo, feliciano, joice hasselmann a família bolsonaro inteira, a bancada evangélica e a bancada ruralista pra redigir uma constituição nova é muito boa a proposta sim petista"
1579,agora faz cenário alckmin x bolsonaro mas não faz ciro x haddad realmente eu não entendi o critério
1581,"entre quem ganha de 2 a 5 salários mínimos, a rejeição de haddad já é quase do tamanho da de bolsonaro já ciro tem a menor rejeição nesse segmento não se trata de gente ""rica"" como a narrativa petista quer construir: é a classe média-baixa, parcela muito expressiva da população pic.twitter.com/oGz7W70M9R"
1582,"o que fica de absolutamente estranho é a queda acentuada de bolsonaro com crescimento em igual proporção de haddad no sul e estagnação dos demais a impressão que dá é de uma transferência direita bolsonaro-haddad, o que não faz o menor sentido no sul do país não sei o que pensar"
1597,"totalmente chocado que, segundo o datapoder, a maior transferência proporcional de votos pro bolsonaro num segundo turno com o haddad é de BOULOS, com 73% não confio em nada nessa pesquisa, mas se esse dado tiver um fundinho de verdade que seja é chocante demais"
1598,exatamente isso! o nível de psicodelia que o petismo atingiu é absurdo só governam os 4 anos se venderem a alma pros neoliberais vejo o governo deles naufragado e bolsonaro vindo quase invencível em 2022 governo haddad seria só adiar a catástrofe em 4 anos
1640,"assim como as entrevistas de ciro e bolsonaro os fortaleceram, a entrevista do haddad o fortalece a gritaria está horrorosa e o povo percebe o clima de inquisição # HaddadNoJornalNacional # CiroSimPosteNão"
1643,haddad tentando ser o bolsonaro falando A GLOBO TMB FAZ LALALALALA como se igualar-se ao lixo tóxico que é a rede globo fosse uma coisa boa # HaddadNoJornalNacional # CiroSimPosteNão
1655,é exatamente pela situação em que o país se encontra que não dá pra ser cordial com o pt eles nos colocam no risco grave de perder pro bolsonaro se ganharem não resolvem o problema e tendem a agrava-lo é preciso deixar claro que ciro e haddad definitivamente NÃO SÃO A MESMA COISA
1675,já pensou alckmin e bolsonaro se matando a campanha inteira os dois começam a derreter aí plau ciro x haddad no segundo turno sonhei
1679,haddad é o único que não vence bolsonaro no segundo turno que a sede de poder do pt não impeçam ciro ou marina de estar no segundo turno pq se for haddad já sabemos o que vai acontecer
1681,gente desculpa mas o haddad NUNCA vai ganhar uma eleição N U N C A votar no haddad é entregar eleição do bolsonaro ele é MUITO FRACO
1794,Ibope: Bolsonaro sobe para 41% dos votos válidos; Haddad cai para 25%; Ciro sobe 
1946,"Haddad DEVERIA SER ESFAQUEADO TBM, PRA FICAR TUDO IGUAL!!!@O SAFADO pede investigação de crime eleitoral por visita de Bolsonaro ao Bope  via @ UOLNoticias # UOLnasUrnas # informacaocontraoAchismo"
1953,Honestamente seria > 68% @ jairbolsonaro e 18% Haddad;.
1958,Bolsonaro tem apoio de 15 candidatos a governador e Haddad tem 3  via @ UOLNoticias # UOLnasUrnas # informacaocontraoAchismo
1963,"PRA QUEM Não entendeu! O @ jairbolsonaro disse acabar com FRAUDES no @ bolsafamilia , ABUSOS e ROUBOS de quem de fato NECESSITA do auxílio. Ele não falou em acabar com o benefício, MAS DEIXÁ-LO TRANSPARENTE!! E se acabar com FRAUDES OBRARÁ ATÉ PARA 13* do mesmo. # Eleicoes2018"
1976,"HUMANAMENTE IMPOSSÍVEL, HAVEREM FEITO A PESQUISA ONDE APARECE HADDAD QUASE EMPATADO COM @ jairbolsonaro SÃO BANDIDOS MENTIROSOS, Jair e @ GeneraIMourao são A PREFERÊNCIA DE TODO POVO BRASILEIRO. SOMENTE LINHAGENS GAYS DE SÃO PAULO, E POUCOS ARTISTAS BAIANOS, PEDEM LULA OU PT."
1977,"HUMANAMENTE IMPOSSÍVEL, HAVEREM FEITO A PESQUISA ONDE APARECE HADDAD QUASE EMPATADO COM @ jairbolsonaro SÃO BANDIDOS MENTIROSOS, Jair e @ GeneraIMourao são A PREFERÊNCIA DE TODO POVO BRASILEIRO. SOMENTE LINHAGENS GAYS DE SÃO PAULO, E POUCOS ARTISTAS BAIANOS, PEDEM LULA OU PT."
1978,"HUMANAMENTE IMPOSSÍVEL, HAVEREM FEITO A PESQUISA ONDE APARECE HADDAD QUASE EMPATADO COM @ jairbolsonaro SÃO BANDIDOS MENTIROSOS, Jair e @ GeneraIMourao são A PREFERÊNCIA DE TODO POVO BRASILEIRO. SOMENTE LINHAGENS GAYS DE SÃO PAULO, E POUCOS ARTISTAS BAIANOS, PEDEM LULA OU PT."
1979,"HUMANAMENTE IMPOSSÍVEL, HAVEREM FEITO ESTA PESQUISA DE HOJE ONDE APARECE HADDAD QUASE EMPATADO COM @ jairbolsonaro SÃO BANDIDOS MENTIROSOS, @ jairbolsonaro É A PREFERÊNCIA DE TODO POVO BRASILEIRO. SOMENTE LINHAGENS GAYS DE SÃO PAULO, E POUCOS ARTISTAS BAIANOS, PEDEM LULA OU PT."
1980,"Preparem-se jovens empreendedores de verdade, qdo @ jairbolsonaro assumir, nascerão oportunidades COM FÉ e ESPERANÇA, no FUTURO. Com Haddad O *MEDO* TOMARÁ CONTA DE TODOS*, POIS OS BANDIDOS PASSARÃO A MANDAR MUITO MAIS.<< # Eleicoes2018 # EleNaopic.twitter.com/q7WT9Zgv8g"
1981,"SURREAL. SE FOSSE VERDADEIRA, seria @ jairbolsonaro 48%, - Haddad 13%- ciro 9%, marina 3% etc"
2079,"to num orgulho q ñ cabe em mim, minha mãe já havia dito que tem medo do que o bolsonaro diz, q tem mt medo da volta dos militares com tudo que viu com meu vô na política, e eu conversei mt com ela tb. Mas hj ela me disse abertamente que vai de Haddad EU AMO UMA MULHER"
2154,"Olavo de Carvalho é um ""fake thinker, um falso pensador caçador de patos"". O professor @ Chrisdunker explica a diferença entre @ OdeCarvalho e @ Haddad_Fernando "
2336,MATOU A MENTIROSA @ jairbolsonaropic.twitter.com/5ynuqeFlmF
2338,"Vem pro debate, @ jairbolsonaro. Sou eleitor e quero saber quais as suas propostas para a segurança, aquelas do site não me convencem."
2342,"Recebeu 7 prêmios, inclusive reconhecimento internacional por sua gestão. Mas se o paulista é marmita de PSDB, ele não pode fazer nada. # VemProDebaten @ jairbolsonaro"
2343,"Aceita, @ jairbolsonaro!"
2346,O HADDAD VAI COMER O CU DO BOLSONARO acho que temos a nova marmitinha # marmitadecorrupto # bolsonarocagao
2437,Tá conversando besteira de votar em bolsonaro ele não gosta de mulher de sapatão nem de viado por isso eu sou mais humilde eu vou votar em HADDAD HADDAD HADDAD HADDAD
2664,Estou confusa. O Temer nao era o vice ESCOLHIDO da mula sem cabeça? Tipo sua vice AVIÃO @ Haddad_Fernando # Nasruascombolsonaro
2743,"Pra 1 pessoa desmentir 1 fato q cai na rede dá um trabalhão, imagina como essas fake news atrapalharam a candidatura do Haddad. E mais, todos os partidos foram prejudicados pq c/ isso elegeram vários políticos aliados do # bolsonarocorrupto tb. É caso de anulação de eleição sim!"
2750,"Haddad manda recado pro Bozo: # VemProDebate!!! Vai Bozo, ou vc só é machão nas redes sociais? Que derrota! # bolsonaroCagao # BolsonaroCovarde"
2764,"Não adianta o Bozo ficar xingando e dando piti... @ Haddad_Fernando deu uma enquadrada monstra nele: ""Vou até a enfermaria, na boa, fazer o debate"". hahaha Vai correr pra onde agora arregão? Covarde duma figa! # bolsonaroCagao"
2765,"Não é justo com um candidato não poder expor suas propostas só pq o outro se recusa a participar de debates. Se o Bolsonaro não quer ir, q não vá... mas é preciso garantir ao Haddad o tempo q lhe é de direito. É o futuro da nação que está em jogo. # DebateNaBand # bolsonaroCagao"
2845,"'Precisamos dialogar com o eleitorado do Bolsonaro', afirma Haddad - Política - Estadão "
2849,"‘Não precisamos de fake news para combater Haddad’, diz Bolsonaro "
2853,"'Se desligar o Whatsapp por cinco dias, o Bolsonaro desaparece', diz Haddad "
2855,Jornalista que mentiu sobre ex-mulher de Bolsonaro é filha de petista aliado de Haddad 
2892,Ibope: Haddad “decola” e já vence Bolsonaro na capital paulista  via @ revistaforum
2899,Datafolha: Bolsonaro perde todos os cenários de 2º turno; Ciro vence Haddad via @ UOLPolitica @ UOL
2917,Bolsonaro aparece 22 pontos à frente de Haddad em nova pesquisa 
2977,BOLSONARO 26% CIRO/HADDAD 13% ALCKMIN 9% MARINA 8% ALVARO/MEIRELLES/AMOEDO 3% DACIOLO/BOULOS/VERA 1% GOULART/EYMAEL 0% BRANCOS OU NULOS 13% NÃO SABE OU NÃO RESPONDEU 6% 
2994,"Ah, você só pode estar brincando! ""Fazer videozinhos"" é a prova?! Wagner Moura, Camila Pitanga, Sonia Braga, todos ""fizeram videozinhos"" para o Haddad. Meu caro, não dá. @ jairbolsonaro é um homem acima do bem e do mal. E digo mais: ele será o teu presidente! # AtentadoFakeDoPT"
3089,Haddad é um doente ..dígno de nossa pena..pois ..como alguém consegue encarar Família olhos nos olhos com um legado de MENTIRAS E SORDIDEZ tão grande quanto ele usou nessa tentativa desesperada pelo poder? # NemVemQueNaoTemPT
3097,Uma NAÇÃO acordando da dormência ! # bolsonaropresidente17 # querenosvotoemcedulas
3098,Legal ver a campanha do Haddad. Queria ver a do bolsonaro
3099,Eu quero que o Haddad e o bolsonaro se fodam
