5791,TSE autoriza que representantes de Bolsonaro e Haddad acompanhem apuração - 
5799,Haddad quer varrer Bolsonaro da face da terra - 
5801,"De Haddad para Bolsonaro: “Vem me enfrentar, soldadinho de araque” - "
5804,Haddad diz que Bolsonaro “recebeu o apoio da Ku Klux Klan” - 
5813,Haddad ganha de Bolsonaro nos lugares mais violentos do Brasil - 
5818,Haddad: “Eles querem que Bolsonaro ganhe sem ter que debater” - 
5820,Assessores de Haddad não descartam vitória de Bolsonaro no primeiro turno - 
5832,"Haddad zomba de Bolsonaro: “Qualquer pergunta difícil, ele remete ao Paulo Guedes” - "
6083,"Este artigo explica como o método de pesquisa do datapoder360 prejudica claramente Bolsonaro e favorece Haddad. Não sei se é proposital, mas é fato... "
6091,"@ jairbolsonaro receberá faixa preta dos Gracie, enquanto isso @ Haddad_Fernando receberá uma calça marrom... # BolsonaroPresidenteEleito # NaoAceitaremosFraude"
6092,"Eleitor de @ Haddad_Fernando qrendo fzr apropriação do capital de ums instituição opressora, aí vem um apoiador de @ jairbolsonaro, fascista, taxista, e possivelmente vocalista impedir a vítima da sociedade de lograr êxito em sua tentativa de Justiça Social! Q q isso?! Q q isso?!"
6117,"...apenas por acobertarem e ñ publicarem uma nota sequer contra @ BarackObama,o esquema globalista e o Foro de SP, e tb por atacarem da forma + sorrateira e covarde possível @ realDonaldTrump e agora @ jairbolsonaro, aqui no consegue ser ainda mais nojenta e sem contraponto."
6119,"Toda a mídia mundial em sua maioria publica fatos q beneficiam a esquerda, me aponte um, apenas um veículo no q seja conservador... NENHUM deles é, nem a q dizem ser de direita ( @ Veja) o é de fato, perceba as ações contra @ jairbolsonaro e note q TODOS os veículos o atacaram..."
6122,"@ jairbolsonaro tem q abrir a caixa preta do @ BNDES, rasgar contratos c/ nações esquerdistas! Por isso q é prioridade, ao meu ver, a reestruturação da política de relações internacionais!"
6152,"Apenas canalhas e mal intencionados votam no PT... Veremos a proporção de canalhas no nessas eleições... @ jairbolsonaro já nos mostrou q a mídia em sua totalidade é canalha, agora nos dará esse outro presente! Nosso presidente é sensacional!"
6192,"@ Datafolha: @ JairBolsonaro tem 59% dos votos válidos, e @ Haddad_Fernando, 41% "
6200,A mentira dos veículos de desinformação está se desfazendo!!! Vai ser lindo esses safados anunciarem @ jairbolsonaro presidente da república dia 28...
6205,"@ CarlaZambelli17 Eles vão tentar, vão espernear, mas já está decidido... @ jairbolsonaro será eleito e é praticamente impossível @ Haddad_Fernando reverter... Se acontecer, é pq a fraude foi absurda e o ACE já disse q vai entrar em cena p/ garantir q seja feita a vontade da maioria"
6210,"Tome vergonha na cara! Sobre # Eleicoes2018: Já tá decidido, @ jairbolsonaro já é nosso presidente. Agora é ironico e até hilário ver o desespero de @ Haddad_Fernando falando em ""fraude"" nas urnas, sendo q as fraudes sempre beneficiam a esquerda! Vcs ñ se enxergam msm."
6216,Vai se fuder seu FDP!!! Tá apelando pq sabe q já perdeu né seu safado... @ jairbolsonaro já é o presidente do ... Tome vergonha na cara!!! # PTNuncaMais
6224,"Ibope: @ JairBolsonaro tem 59% dos votos válidos e @ Haddad_Fernando, 41% "
6237,"@ Haddad_Fernando diz em seu programa partidário/eleitoral q é exatamente o oposto de @ jairbolsonaro... Fique tranquilo @ Haddad_Fernando, nós sabemos disso, por isso votamos em @ jairbolsonaro # BrasilComBolsonaro17 # PTNuncaMais"
6247,"Atenção @ jairbolsonaro @ FlavioBolsonaro @ CarlosBolsonaro @ BolsonaroSP, vamos lembrar ao povo brasileiro sobre as falar de @ LulaOficial disse... Vamos desmascarar esses canalhas da esquerda!!!"
6254,"Confesso q tb me preocupo, mas a vitória de @ jairbolsonaro será certa! Temos q nos alertar p/ q virá após a confirmação... A luta continua, intensa e forte contra a esquerda! # BrasilComBolsonaro17 E qd estivermos dentro do sistema, muda-lo!"
6260,"Vamos lembrar o ano de 2006... @ LulaOficial fugiu ds debates c/ @ geraldoalckmin... @ jairbolsonaro está cumprindo recomendações médicas, e msm se fosse aos debates, acho q ele passaria c/ o carro em cima de @ Haddad_Fernando!"
6270,Haddad falou: que bolsonaro criou uma facção criminosa nas redes sócias! Será que ele tá falando de mim? Kkkkkkkkkkkk
6274,Matemática simples 16 estados + distrito federal é # bolsonaro 9 estados é # haddad Se continuar assim dia 28 É mito na kbca Então vamos se alcamar Os números já mostraram Nordeste sozinho não elege Haddad.
6321,"vou mandar pra minha vó o jornal que mostra a diferença entre o bolsonaro e o haddad, me apegando num fio de esperança que ela e meu avô mudem os votos"
6330,Essa internet é ótima mesmo.....nada escapa!!! @ AnaMLopesFotos @ jairbolsonaro @ Haddad_Fernando pic.twitter.com/kWLRgkVZ8S
6332,Uai..... @ ptbrasil @ Haddad_Fernando @ jairbolsonaro @ BolsonaroSP estou confuso. Falando mentira na TV?? Que feio?pic.twitter.com/bcp75KdgSD
6346,Haddad e partido de Ciro vão à Justiça para cassar chapa de Bolsonaro EU TÔ GRITANDOOOOOO  via @ VEJA # Caixa2doBolsonaro
6362,"a rejeição do haddad é muito maior que a do bolsonaro, chocado"
6439,Haddad está propagando fake news no programa de rádio falando que houve comprovação e flagrante de caixa 2 de Bolsonaro @ TSEjusbr @ jairbolsonaro
6495,Última pesquisa. Bolsonaro sobe e vence Haddad no 2 Turno 
6521,"Ibope: Na capital paulista, Haddad supera Bolsonaro "
6523,Haddad: Bolsonaro 'vai tomar uma surra do povo brasileiro no domingo' 
6524,"Alberto Goldman declara apoio a Haddad e diz que Bolsonaro ""passou dos limites"" "
6529,Haddad propõe mais tempo na escola e diz que Bolsonaro quer Estado ausente 
6533,"Comparamos os planos de governo de Haddad e Bolsonaro para jovens, mulheres, LGBT+ e mais "
6553,"Haddad vence Bolsonaro no segundo turno, aponta Big Data/Record - Lula "
6557,BOLSONARO 31% X 20% HADDAD (CRUSOÉ) - O Antagonista 
6560,"Pesquisa Ibope: Sob ataque, Bolsonaro estaciona em 28%; Haddad vai a 22% - Política - Estadão "
6563,DataPoder360 mostra Bolsonaro e Haddad em empate técnico no 1.º turno | Eleições 2018 
6565,"Associado diretamente a Lula, Haddad soma 22% e ultrapassa Bolsonaro "
6577,"Ô meus anjos não esqueçam que estar contra o bolsonaro, montar grupinho pró haddad e ficar removendo quem pensa diferente dentro da militância, eh característica fascista tbm viu"
6587,"Gostei da parte que o Sr @ Haddad_Fernando escreve ""corrigir os erros e retomar os acertos"", isso só prova que o sr também vai votar em @ jairbolsonaro"
6594,"Já parou pra pensar que @ jairbolsonaro está sempre de cara fechada quando aparece? Eu fui me olhar no espelho e comecei a pensar na situação atual do Brasil e da Venezuela, automaticamente minha cara se fechou. Indignação essa é a cara. Fique atento ao sorriso maroto de Haddad."
6598,"13% de diferença, divulgado pelo G1 me cheira a fraude nas urnas, o povo sabe que a diferença é bem maior // G1Ibope para presidente, votos válidos: Bolsonaro, 57%; Haddad, 43%.  via @ GoogleNews"
6609,"Enquanto @ jairbolsonaro faz campanha nas redes sociais, @ Haddad_Fernando faz Stand Up na mídia podre"
6627,"Uma cagada da pra limpar com papel, mas uma diarréia não // G1: Após criticar o PT, Cid Gomes diz que 'Haddad é infinitamente melhor que Bolsonaro'.  via @ GoogleNews"
6634,Até se fosse a favor do socialismo @ jairbolsonaro seria melhor que Haddad
6643,"Se infiltra? Como assim, local privado? Novamente vcs cagando na democracia // Militante pró-Bolsonaro se infiltra em ato por Haddad: Estou num país livre @ UOL"
6651,"Tá bom, qualquer coisa é Bolsonaro agora, enfiaram uma mortadela no rabo do Haddad, de quem é a mortadela? //. Transexuala no Rio: ?Estão usando Bolsonaro para nos atacar? @ UOL"
6653,E como diria aquele ditado: Mais vale um @ jairbolsonaro com pé no chão do que dois @ Haddad_Fernando voando.
6657,Canalha e cara de pau // Bolsonaro chama Haddad de 'canalha' após proposta contra fake news @ jornalodia 
6658,Será que desta vez constituição vai ser levada a sério? // Haddad recua de Constituinte e Bolsonaro desautoriza vice ao vivo no JN  via @ exame
6659,"Atenção seguidores de @ jairbolsonaro , vamos cuidar com tudo que é postado a respeito do apoio nordestino ao Haddad, essas postagens quando enfatizadas por petista podem parecer ou até se tornar ofensas. "
6666,"Ibope para presidente, votos válidos: Bolsonaro, 59%; Haddad, 41% "
6668,# GloboLixo através do Jornal Nacional fazendo uma bela matéria para o Haddad. É incrível a falta de caráter do editorial desta empresa. Olha aí @ jairbolsonaro # MudaBrasil17 # MudaBrasil17
6672,"Que todos os guias e Orixás de Umbanda estejam neste momento irradiando uma vitória como nunca antes na história deste país ao candidato @ jairbolsonaro . Axé, Capitão!"
6707,17 é bolsonaro
6741,Globo fazendo campanha agora pro Haddad...podre! Mesmo assim não vai vencer @ jairbolsonaro
6783,Bolsonaro Desmente Haddad e Boulos 
6835,Os do Haddad a gente já sabe onde: 
6993,Oo @ Haddad_Fernando critica e critica tanto @ jairbolsonaro mas só copia. Eitaa amor enrustido heimm? pic.twitter.com/3ic8NmpAzj
6994,Oo @ Haddad_Fernando critica e critica tanto @ jairbolsonaro mas só cópia. Eitaa amor enrustido heimm?pic.twitter.com/s4DlxPtA3j
7019,"É isso amigos... Após desistência de Bolsonaro, Globo cancela debate e não entrevista Haddad  via @ mauriciostycer"
7032,"Repassem! Comparamos os planos de governo de Haddad e Bolsonaro para jovens, mulheres, LGBT e mais  via @ vicebrasil"
7042,"Tão macho, como ele gosta de dizer, que só se garante em cima das fakes news. Se trabalha com mentira na campanha, o que será da gestão? Bolsonaro recusa pacto contra fake news e chama Haddad de 'canalha' - "
7076,bolsonaro 42% x haddad 42% O MEU CU TA NA MÃO PORRAAAAAAAAAA
7124,Haddad: políticos de outros partidos e antipetistas dizem que Bolsonaro não dá 
7125,"Datafolha, votos válidos: Bolsonaro, 55%; Haddad, 45% "
7129,"Haddad cresce entre as mulheres e já empata tecnicamente com Bolsonaro, diz Datafolha | Revista Fórum "
7133,"Bolsonaro é a própria fake news, diz Haddad em campanha na Paraíba "
7134,"Bolsonaro é a própria fake news, diz Haddad em campanha na Paraíba - Política - Estadão "
7137,"Entre LGBTs, Haddad lidera com 57% e Bolsonaro tem 29% "
7138,"Bolsonaro e Haddad empatam entre mulheres, mas têm 20 pontos de distância entre homens "
7141,Haddad: Bolsonaro 'vai tomar uma surra do povo brasileiro no domingo' 
7148,"'Fiz uma opção: derrotar Jair Bolsonaro', diz Haddad em Ato da Virada, no Rio "
7155,Datafolha: Jair Bolsonaro lidera com 56% dos votos válidos; Fernando Haddad tem 44% 
7157,"VIRA VOTO: HADDAD 51% X 49% BOLSONARO em SÃO PAULO após DORIA DERRUBÁ-LO, diz IBOPE "
7160,"'Fiz uma opção: derrotar Jair Bolsonaro', diz Haddad em Ato da Virada, no Rio "
7170,"Haddad acusa Bolsonaro de já 'lotear' governo, mas acredita que pode virar "
7172,"Ibope mostra Bolsonaro com 57% dos votos válidos e Haddad, 43%, no 2º turno "
7173,"Ibope: Bolsonaro tem 57%; Haddad, 43% "
7174,"Ibope: Bolsonaro tem 57%; Haddad, 43% "
7178,"Bolsonaro diz que não acredita em ""virada de Haddad"" "
7179,Saiba o que Bolsonaro e Haddad propõem para a economia 
7181,"Após fala de filho de Bolsonaro sobre STF, Eymael anuncia apoio a Haddad "
7184,"Bolsonaro tem 57% e Haddad registra 43% dos votos válidos, diz pesquisa CNT/MDA "
7187,Haddad chama Bolsonaro de chefe de milícia e diz que Paulo Guedes é Temer piorado 
7189,Haddad e partido de Ciro vão à Justiça para cassar chapa de Bolsonaro 
7192,Haddad chama Bolsonaro de 'soldadinho de araque' e critica ausência em debates 
7195,Haddad/Lula desvendam crime eleitoral de Bolsonaro - Blog da Cidadania 
7196,Haddad: elite vota em Bolsonaro acreditando que ele será 'tutelado por generais' 
7200,Haddad: elite vota em Bolsonaro acreditando que ele será 'tutelado por generais' 
7202,"CUT/Vox Populi: Bolsonaro registra 53% e Haddad, 47% "
7204,Ex-ministros de Itamar e FH pedem para Haddad unir adversários contra Bolsonaro 
7205,Pesquisa CUT/Vox Populi traz Bolsonaro com 53% e Haddad com 47% 
7207,Vox Populi: Haddad cresce e chega a 46% dos votos válidos; Bolsonaro tem 54% | Revista Fórum 
7209,Haddad diz ter testemunha de campanha irregular de Bolsonaro 
7210,Fraude de Bolsonaro contra Haddad dá cana! - Blog da Cidadania 
7211,Datafolha: Jair Bolsonaro lidera com 59% dos votos válidos; Fernando Haddad tem 41% 
7212,Juristas declaram apoio a Haddad e defendem recorrer ao TSE contra Bolsonaro 
7217,Haddad diz que irá à Justiça contra empresários e Bolsonaro 
7224,"Contra Bolsonaro, parte dos antipetistas indica voto em Haddad no segundo turno "
7229,"Haddad, sobre Bolsonaro: ‘ao não se controlar, ele não controla mais ninguém’ "
7238,Haddad grava vídeo desafiando Bolsonaro a participar de debates - ISTOÉ Independente 
7240,Haddad pede investigação de crime eleitoral por visita de Bolsonaro ao Bope 
7242,Haddad entra com ação contra Bolsonaro por abuso de poder econômico 
7245,"Sem Bolsonaro, PT pede que SBT entreviste Haddad no horário do debate "
7248,Coligação de Haddad pede que visita de Bolsonaro ao Bope seja investigada 
7249,Coligação de Haddad pede que visita de Bolsonaro ao Bope seja investigada 
7251,"Haddad, sobre Bolsonaro: 'Por que entrevista pode e debate não?' "
7253,Coligação de Haddad pede que visita de Bolsonaro ao Bope seja investigada 
7258,Haddad sobre eventual governo Bolsonaro: 'Botina no pescoço de quem discordar' 
7261,Reunião no TSE com representantes de Haddad e Bolsonaro sobre fake news é adiada 
7263,"Ibope: Para eleitores, Bolsonaro é quem mais defende os ricos e Haddad, os pobres - Política - Estadão "
7265,Ibope: Jair Bolsonaro lidera com 59% dos votos válidos; Fernando Haddad tem 41% 
7268,"Bolsonaro perde de Haddad por 45% a 39% no 2º turno, diz Datafolha "
7276,"""...Na primeira pesquisa de intenção de voto feito pelo Datafolha após o primeiro turno, Bolsonaro apareceu com 58% dos votos válidos, enquanto Haddad teve 42%. Uma pesquisa Ibope é esperada para amanhã..."" (Ibope, hoje, 15/10/2018, segunda-feira). "
7277,"Haddad: existe um muro que separa FHC de Bolsonaro; de mim, é uma porta "
7284,Haddad vai explorar contradições de Bolsonaro sobre Bolsa Família na TV - Painel 
7292,Haddad ataca Bolsonaro e Edir Macedo e é chamado de 'abortista' por fiel 
7293,Haddad associa Bolsonaro ao nazismo e diz que rival é 'grandessíssimo mentiroso' 
7294,Haddad associa Bolsonaro ao nazismo e diz que rival é 'grandessíssimo mentiroso' 
7296,"Em missa com Haddad, padre critica proposta de Bolsonaro de armar a população "
7298,Haddad diz que Bolsonaro tem 'uma vida dedicada à violência' 
7299,Bolsonaro admite não ir a debates com Haddad por 'estratégia' 
7301,"Haddad, sobre Bolsonaro: por que entrevista pode e debate não? "
7303,"""...O candidato do PT à Presidência da República, Fernando Haddad, gravou um curto vídeo desafiando o adversário e líder das... "
7306,"""...O presidenciável pelo PT, Fernando Haddad, voltou a atacar o guru econômico de seu adversário neste segundo turno,... "
7315,Bolsonaro vence primeiro turno e enfrentará Haddad no segundo 
7342,Acho que Haddad vai ficar inelegível! 
7401,"# HoraDaVirada # DitaduraNuncaMais Haddad cresce, o concorrente cai e eleição está aberta "
7460,Q feio fantástico vai fazer campanha p Haddad p puta q pariu criem vergonha na cara se o bolsonaro não ganhar o povo vai p rua porq e fraude sempre querendo foder c o povo
7461,Deus u livre o PT primeiro q quem vai mandar mesmo vai ser o presidiário q tá lá o Haddad só tá representando e povo c essa cabecinha c medo q volte a ditadura prefere votar em um ladrao mas eu acredito q o bolsonaro já ganhou
7536,Blog: Bolsonaro lidera com 56%; rejeição a Haddad é enorme: 
7541,"Blog: Em SP, Haddad é humilhado por Bolsonaro: "
7543,"Haddad sofrerá derrota mais que humilhante em SP, diz Instituto Paraná "
7600,"Haddad foi longe demais, diz Bolsonaro "
7603,"‘Não precisamos de fake news para combater Haddad’, diz Bolsonaro  via @ VEJA"
7614,Blog: Nova pesquisa mostra Bolsonaro com 59%; Haddad está com 41%: 
7675,Blog: Pesquisa Ibope mostra 59% de Bolsonaro contra 41% de Haddad: 
7684,"Blog: Em SP, Bolsonaro massacra Haddad, segundo pesquisa: "
7686,Em São Paulo a eleição acabou para Haddad.... 
7688,"Instituto Paraná, SP: Bolsonaro 59,1% X 25,5% Haddad - O Antagonista "
7714,E o bolsonaro que enquanto deputado não fez nada pela segurança. Nem do estado dele que está com uma crise de segurança tem tempos! Aproveita e pede pro teu candidato ir no debate. Ou as emissoras estão recebendo 600 milhões pra ele não ir?
7729,"eu total, pensando até em silenciar as palavras bolsonaro e haddad, meu psicologico tá se fudendo com essa politica"
7737,"né não, porque vai se juntar a escoria do povo que é contra o pt e a escoria que era a favor do bolsonaro, e vai acabar que o Haddad vai governar pra uma merreca parte da população e com um monte de gente poderosa querendo ele fora do poder, ou seja, mais 4 anos de instabilidade pic.twitter.com/qFHesOhwBL"
7857,Pesquisa Datafolha mostra Bolsonaro com 56% e Haddad com 44%; diferença cai 6 pontos  
7864,"Bolsonaro, com 58% dos votos válidos, tem 16 pontos de vantagem sobre Haddad, diz Datafolha  "
7877,Ibope: Bolsonaro atinge 32% e Haddad soma 23% das intenções de voto  
7878,"Bolsonaro vai a 31% e Haddad fica estável em 21%, diz Ibope  "
7981,A manipulação das pesquisas: superestimam Haddad e subestimam Bolsonaro. Vai ser no primeiro turno gente. Não vamos desanimar por pesquisas tendenciosas. 
8189,"O Haddad mudou pra corrente majoritária do PT (que apoia ditaduras) e agora só é um fantoche do Lula, confio nadica de nada nele. STF absolveu Bolsonaro sobre a denúncia de racismo e que em si não fazia muito sentido. "
8230,"Por favor, não me façam escolher entre bolsonaro e Haddad no segundo turno. Conto com a colaboração de todos"
8231,jornal nacional mostrando a última semana de campanha dos candidatos e só vemos o haddad indo em evento atrás de evento... do bolsonaro só vai mostrar ele em casa se coçando # ViraVotoHaddad
8232,"e a minha vó que foi só cortar o cabelo e acabou virando um pro haddad “A Ana (cabeleireira) ia votar no bolsonaro aí eu falei pra ela tudo que ja disse de sobre mulheres, aquele caso da maria do rosário... fiquei até espantada q ela n sabia mas agora ela vai votar no 13”"
8233,observo as pessoas na rua e fico imaginando se ela tem cara de votar no haddad ou no bolsonaro
8252,"Comparamos os planos de governo de Haddad e Bolsonaro para jovens, mulheres, LGBT e mais  via @ vicebrasil"
8344,Esse covarde soh encara Haddad pelo Wi Fi que VERGONHA 
8536,Rio tá com @ jairbolsonaro
8537,@ Haddad_Fernando como VCS falam que @ jairbolsonaro posta fake news se VCS do PT não têm escrúpulos algum.
8544,@ jairbolsonaro não debate com gente que recebe ordens.
8553,"@ Haddad_Fernando o senhor diz que @ jairbolsonaro não fez nada em 20 anos. Eu acho que fez. Fez muito. Barrar o kit gay foi muito. Mas quanto ao senhor, porque não se reelegeu em São Paulo? Sua administração não agradou?"
8555,"Esse @ Haddad_Fernando se acha ofendido pelo @ jairbolsonaro , mas ele também vive falando coisas fantasiosas sobre o nosso mito. Por favor professor Haddad, pare com isso. Não diga nunca mais que bolsonaro apóia estupro, pelo contrário."
8557,@ Haddad_Fernando pare com o desespero! o @ jairbolsonaro nunca falou que Nordestino deveria comer capim. Quem falou isso foi um associado ao PT. Para pelo amor de Deus.
8558,"@ Haddad_Fernando vc faz tudo para denegrir @ jairbolsonaro , querido NÃO CHAME BOLSONARO DE ESTUPRADOR! CHEGA ! QUANTAS COISAS FANTASIOSAS VC FALOU DO BOLSONARO. QUE DESESPERO."
8562,É por isso que @ jairbolsonaro sim!!!! DEUS me livre de votar em psol @ Haddad_Fernando . Respeitem a polícia seus militantes de bosta.
8566,@ Haddad_Fernando aceita que tá ficando feio. Esta dando a parecer que vcs querem TOMAR o Brasil para aí. Somos muito mais de 70 milhões que queremos @ jairbolsonaro . Respeite a constituição.
8568,@ Haddad_Fernando soldadinho de ataque é vc!!!! Que acata ordens da cadeia. @ jairbolsonaro será teu presidente sim. Em janeiro subirá a rampa dos três poderes. Aceita que dói menos.
8570,Meu caro Haddad aceita que dói menos. Esse sujeito se chama @ jairbolsonaro e SERÁ SIM SEU PRESIDENTE. Fora fora fora aaaa pt
8574,"Direitos respeitados? Vc tem uma vice presidente comunista declarada, apoiadora do socialismo e vem falar de direitos respeitados. Seria os teus direitos né? @ jairbolsonaro presidente URGENTE."
8575,"@ Haddad_Fernando Não meu querido, vc NÃO VAI CONSEGUIR DERRUBAR a candidatura de @ jairbolsonaro . Vi vc na TV do lado de Jandira Fegalli rs rs rs. Não! Vc, Fegalli, Manuel D'Ávila NÃO REPRESENTAM MEU BRASIL."
8577,@ jairbolsonaro o Haddad esta te DETONANDO NSS PROPAGANDAS ELEITORAIS! Vc vai deixar?
8580,"@ jairbolsonaro PELO AMOR DE DEUS!!!! vc tem de ir ao debate. Sou tua fã nr 1.te amo. Mas para de renegar debate. Ainda mais com o Haddad, vc tem capacidade de acabar com ele."
8584,E garanto @ fernandohaddad que em um debate com o @ jairbolsonaro vc Haddad será ESMAGADO.
8593,"Haddad na TVE: “Bolsonaro pessoa física não mete medo. O que ele incita, sim, causa medo” "
8594,"Intelectuais e artistas da América e da Europa alertam sobre Bolsonaro ntelectuais-e-artistas-da-america-e-da-europa-alertam-sobre-bolsonaro/#.W9NekKw0Syg.twitter VOTE CERTO, VOTE HADDAD"
8733,Sem reconhecimento de ninguém?! Bom o @ Haddad_Fernando já disse que vai tirar todos e o @ jairbolsonaro vai manter boa parte.... Entre as duas pessimas opções isso é algo que faz diferença pra defenir o voto.
8773,BOLSONARO É HADDAD 13 
8775,todo dia haddad comendo o cu do bolsonaro no twitter
8782,tem gente achando que tá todo mundo feliz com haddad indo pro segundo turno também mano ele infelizmente é agora a nossa última chance de eliminar o bolsonaro dessas eleições mas vai ser muito difícil e eu nem sei se vamos conseguir isso
8806,Nova pesquisa BTG Pactual mostra Bolsonaro 59% x 41% Haddad - Notícias Agrícolas …
8808,"Bolsonaro tem 69,6% das intenções de voto do eleitorado mineiro; Haddad, 30,4% – Jovem Pan Online "
8821,"bom, pra quem não acredita, É NA CIDADE DE SÃO PAULO SEUS BURRO. PESQUISA"
9067,"To deitadinha aq na minha rede, qndo ouço da rua um menininho gritando ""bolsonaroo, bolsonaro"", os outros dois revoltados: haddad, haddad, haddad!!! Faz uns 5 min já e eles continuam"
9073,Vox Populi: Bolsonaro tem 44% contra 39% de Haddad 
9083,"A eleição de Fernando Haddad é fundamental para bloquear esse cenário dantesco. No entanto, a eleição de Haddad não deve suscitar ilusões. A luta das classes trabalhadoras serão mais duras nos próximos tempos. "
9121,# brasilcombolsonaro17 # Central das Notícias Nem Lula acredita na vitória de Haddad 
9175,"O lula fudei tudo desde o início com a insistência da permanência na chapa, jurava q o povo ia clamar por ele, não deu certo, não deu tempo de explorar o bom moço Haddad, não convence quem odeia o pt, não convence quem odeia o bolsonaro."
9180,"Ta muito difícil de acreditar no pt novamente, mas se no segundo for Haddad x bolsonaro, certeza q vou no Haddad. Vai dar merda, mas # EleNao # eleNunca # Ciro12"
9212,"Haddad chama Bolsonaro de miliciano, trambiqueiro e destrambelhado no CE  via @ blogdojosias"
9230,"Pesquisa Datafolha para presidente: Bolsonaro, 35%; Haddad, 22%; Ciro, 11%; Alckmin, 8%; Marina, 4% "
9234,"Pesquisa Ibope para presidente: Bolsonaro, 31%; Haddad, 21%; Ciro, 11%; Alckmin, 8%; Marina, 4% "
9357,"olha o haddad falando em mentiras, justo ele, que fala q o bolsonaro vai torturar todo mundo, q o brasil vai voltar a ditadura, q piada heim haddad"
9359,"pior coisa é ve a cara do haddad nos jornais se fazendo de boa pessoa, mas aí o cara abre a boca e so sabe falar do bolsonaro, q imbecil, so fica repetindo: fake news, pro uni, facismo e bla bla bla"
9363,"uma coisa é certa, politicos preocupados com a vitoria do bolsonaro, artistas, jornalistas pelo simples fato de terem medo de perderem a mamata, e vão perder, por isso essas merdas fazem campanha pro lixão do haddad!"
9368,"a diferença do haddad pro bolsonaro é q o haddad é um fantoche, ñ vai fazer nd, pq quem vai governar é o presidiario, ja o bolsonaro vai governar e botar orgem e progresso nessa zona aqui"
9376,"se o bolsonaro for ruim eu n voto nele daqui 4 anos, esse é o pensamento de gente normal, ja o petista pensa, se o haddad for mal, eu voto em outro petista daqui a 4 anos"
9399,meu deus é impossível alguém assistir o fernando haddad no # RodaViva e escolher votar no bolsonaro e a equipe dele
9400,meu deus é impossível alguém assistir o fernando haddad no roda viva e escolher votar no bolsonaro e a equipe dele
9404,vc percebe o quanto tá sendo afetado pela eleição quando tá andando na rua olhando todo mundo e se perguntando será q vota em bolsonaro ou haddad
9713,ta conversando bestera que vota em bolsonaro ele n gosta de mulher de sapatao nem de viado por isso eu so mais humilde eu vo vota em haddad haddad haddad EU VO VOTA EM HADDAD HADDAD HADDAD pic.twitter.com/svM7UCQRJ5
9802,"A pessoa que você está citando é a que mais vem sofrendo sobre fake news sobre ele, já que uma empresa está pagando 12 MILHÕES para isso. Isso foi dia 5, no dia 8 Haddad mudou de opinião e o B recusou "
9814,bolsonaro vota a favor do congelamento da saúde e educação e eu sou obrigada a ler que foi haddad wtf
9831,vídeo do haddad na capoeira x vídeo do bolsonaro fakeando flexão choose your fighter
